{
  "schemaVersion": "1.0.0",
  "recordId": "ags101-ws2-synthetic-capture-subset-v1",
  "classification": "synthetic",
  "specimen": {
    "consoleId": "not-applicable-synthetic",
    "boardId": "not-applicable-synthetic",
    "lcdLabel": "not-applicable-synthetic",
    "brightnessMode": "synthetic-loopback",
    "warmupSeconds": 0,
    "ambient": {
      "temperatureC": 25,
      "illuminanceLux": 0
    },
    "power": {
      "source": "synthetic",
      "chargerConnected": null,
      "batteryVoltage": null
    },
    "panelHistory": "not applicable: deterministic synthetic capture",
    "overlay": "none",
    "measurementGeometry": {
      "patchPixels": [
        240,
        160
      ],
      "samplePointPixels": [
        119.5,
        79.5
      ],
      "detectorDistanceMm": null,
      "viewAngleDegrees": [
        0,
        0
      ]
    },
    "detector": {
      "manufacturer": "Retro Display Lab",
      "model": "deterministic waveform generator",
      "serial": "synthetic",
      "bandwidthHz": null,
      "linearityCalibration": "exact synthetic response"
    },
    "acquisition": {
      "sampleRateHz": 2000,
      "repetitions": 3,
      "pretriggerSeconds": 0.02
    },
    "stimulus": {
      "generator": "tools/build-ags101-ws2.mjs",
      "testRom": "generated/ws2-stimulus-v1",
      "patternSha256": "edda049b895154438710ece03401b039bcacd2be3de07db545d79370bd83457a",
      "preconditionFrames": 120,
      "fromDwellSeconds": 2,
      "toDwellSeconds": 2
    }
  },
  "eventTimeZero": {
    "reference": "source-frame-edge",
    "description": "Synthetic trigger edge aligned by capture-pipeline.mjs.",
    "triggerUncertaintySeconds": 0.0005
  },
  "responseUnits": "normalized-transition",
  "coverage": {
    "channels": [
      "r",
      "g",
      "b"
    ],
    "codeRange": [
      0,
      31
    ],
    "expectedCellCount": 3072,
    "recordedCellCount": 1
  },
  "samples": [
    {
      "id": "accepted-clean-r0",
      "channel": "r",
      "fromCode": 0,
      "toCode": 31,
      "repetition": 0,
      "status": "transition",
      "eventTimeZeroSeconds": 0,
      "fromPlateau": 0,
      "toPlateau": 1,
      "timesSeconds": [
        0,
        0.0005,
        0.001,
        0.0015,
        0.002,
        0.0025,
        0.003,
        0.0035,
        0.004,
        0.0045,
        0.005,
        0.0055,
        0.006,
        0.0065,
        0.007,
        0.0075,
        0.008,
        0.0085,
        0.009,
        0.0095,
        0.01,
        0.0105,
        0.011,
        0.0115,
        0.012,
        0.0125,
        0.013,
        0.0135,
        0.014,
        0.0145,
        0.015,
        0.0155,
        0.016,
        0.0165,
        0.017,
        0.0175,
        0.018,
        0.0185,
        0.019,
        0.0195,
        0.02,
        0.0205,
        0.021,
        0.0215,
        0.022,
        0.0225,
        0.023,
        0.0235,
        0.024,
        0.0245,
        0.025,
        0.0255,
        0.026,
        0.0265,
        0.027,
        0.0275,
        0.028,
        0.0285,
        0.029,
        0.0295,
        0.03,
        0.0305,
        0.031,
        0.0315,
        0.032,
        0.0325,
        0.033,
        0.0335,
        0.034,
        0.0345,
        0.035,
        0.0355,
        0.036,
        0.0365,
        0.037,
        0.0375,
        0.038,
        0.0385,
        0.039,
        0.0395,
        0.04,
        0.0405,
        0.041,
        0.0415,
        0.042,
        0.0425,
        0.043,
        0.0435,
        0.044,
        0.0445,
        0.045,
        0.0455,
        0.046,
        0.0465,
        0.047,
        0.0475,
        0.048,
        0.0485,
        0.049,
        0.0495,
        0.05,
        0.0505,
        0.051,
        0.0515,
        0.052,
        0.0525,
        0.053,
        0.0535,
        0.054,
        0.0545,
        0.055,
        0.0555,
        0.056,
        0.0565,
        0.057,
        0.0575,
        0.058,
        0.0585,
        0.059,
        0.0595,
        0.06,
        0.0605,
        0.061,
        0.0615,
        0.062,
        0.0625,
        0.063,
        0.0635,
        0.064,
        0.0645,
        0.065,
        0.0655,
        0.066,
        0.0665,
        0.067,
        0.0675,
        0.068,
        0.0685,
        0.069,
        0.0695,
        0.07,
        0.0705,
        0.071,
        0.0715,
        0.072,
        0.0725,
        0.073,
        0.0735,
        0.074,
        0.0745,
        0.075,
        0.0755,
        0.076,
        0.0765,
        0.077,
        0.0775,
        0.078,
        0.0785,
        0.079,
        0.0795,
        0.08,
        0.0805,
        0.081,
        0.0815,
        0.082,
        0.0825,
        0.083,
        0.0835,
        0.084,
        0.0845,
        0.085,
        0.0855,
        0.086,
        0.0865,
        0.087,
        0.0875,
        0.088,
        0.0885,
        0.089,
        0.0895,
        0.09,
        0.0905,
        0.091,
        0.0915,
        0.092,
        0.0925,
        0.093,
        0.0935,
        0.094,
        0.0945,
        0.095,
        0.0955,
        0.096,
        0.0965,
        0.097,
        0.0975,
        0.098,
        0.0985,
        0.099,
        0.0995,
        0.1,
        0.1005,
        0.101,
        0.1015,
        0.102,
        0.1025,
        0.103,
        0.1035,
        0.104,
        0.1045,
        0.105,
        0.1055,
        0.106,
        0.1065,
        0.107,
        0.1075,
        0.108,
        0.1085,
        0.109,
        0.1095,
        0.11,
        0.1105,
        0.111,
        0.1115,
        0.112,
        0.1125,
        0.113,
        0.1135,
        0.114,
        0.1145,
        0.115,
        0.1155,
        0.116,
        0.1165,
        0.117,
        0.1175,
        0.118,
        0.1185,
        0.119,
        0.1195,
        0.12,
        0.1205,
        0.121,
        0.1215,
        0.122,
        0.1225,
        0.123,
        0.1235,
        0.124,
        0.1245,
        0.125,
        0.1255,
        0.126,
        0.1265,
        0.127,
        0.1275,
        0.128,
        0.1285,
        0.129,
        0.1295,
        0.13,
        0.1305,
        0.131,
        0.1315,
        0.132,
        0.1325,
        0.133,
        0.1335,
        0.134,
        0.1345,
        0.135,
        0.1355,
        0.136,
        0.1365,
        0.137,
        0.1375,
        0.138,
        0.1385,
        0.139,
        0.1395,
        0.14,
        0.1405,
        0.141,
        0.1415,
        0.142,
        0.1425,
        0.143,
        0.1435,
        0.144,
        0.1445,
        0.145,
        0.1455,
        0.146,
        0.1465,
        0.147,
        0.1475,
        0.148,
        0.1485,
        0.149,
        0.1495,
        0.15,
        0.1505,
        0.151,
        0.1515,
        0.152,
        0.1525,
        0.153,
        0.1535,
        0.154,
        0.1545,
        0.155,
        0.1555,
        0.156,
        0.1565,
        0.157,
        0.1575,
        0.158,
        0.1585,
        0.159,
        0.1595,
        0.16
      ],
      "opticalResponse": [
        0,
        0.016856315365,
        0.033428495362,
        0.049721329468,
        0.065739526423,
        0.081487715599,
        0.096970448331,
        0.112192199238,
        0.127157367511,
        0.141870278189,
        0.156335183404,
        0.170556263615,
        0.184537628813,
        0.19828331971,
        0.211797308906,
        0.225083502039,
        0.23814573891,
        0.250987794597,
        0.263613380544,
        0.276026145632,
        0.288229677237,
        0.300227502265,
        0.312023088171,
        0.323619843961,
        0.335021121178,
        0.34623021487,
        0.357250364544,
        0.368084755101,
        0.378736517753,
        0.389208730934,
        0.399504421188,
        0.40962656404,
        0.419578084859,
        0.429361859706,
        0.438980716158,
        0.448437434132,
        0.457734746686,
        0.466875340807,
        0.475861858192,
        0.484696896005,
        0.493383007634,
        0.501922703427,
        0.510318451414,
        0.518572678026,
        0.52668776879,
        0.534666069026,
        0.542509884516,
        0.550221482179,
        0.55780309072,
        0.565256901276,
        0.572585068051,
        0.579789708936,
        0.586872906122,
        0.593836706702,
        0.600683123264,
        0.607414134468,
        0.614031685626,
        0.620537689254,
        0.626934025633,
        0.633222543349,
        0.639405059827,
        0.645483361858,
        0.651459206112,
        0.657334319652,
        0.663110400424,
        0.668789117758,
        0.674372112841,
        0.679860999199,
        0.685257363157,
        0.690562764303,
        0.695778735933,
        0.700906785501,
        0.705948395048,
        0.710905021635,
        0.715778097761,
        0.720569031779,
        0.725279208302,
        0.729909988604,
        0.734462711013,
        0.738938691297,
        0.743339223046,
        0.747665578045,
        0.751919006639,
        0.756100738099,
        0.760211980975,
        0.764253923444,
        0.768227733657,
        0.772134560071,
        0.775975531787,
        0.779751758873,
        0.783464332684,
        0.78711432618,
        0.790702794235,
        0.79423077394,
        0.797699284907,
        0.801109329559,
        0.804461893423,
        0.807757945414,
        0.810998438112,
        0.814184308044,
        0.817316475947,
        0.820395847041,
        0.823423311284,
        0.826399743635,
        0.829326004304,
        0.832202939,
        0.835031379177,
        0.837812142275,
        0.840546031953,
        0.843233838325,
        0.845876338185,
        0.848474295234,
        0.851028460299,
        0.853539571553,
        0.856008354723,
        0.858435523306,
        0.86082177877,
        0.863167810759,